rating,summary,recommend,response,body,review_date,reviewer_name,reviewer_email,verified,helpfulness_yes,helpfulness_no,product_id
1,Architecto rerum qui.,false,,Alias praesentium in omnis libero alias quis tempora aperiam suscipit.7Non quae sit autem nihil.7Et eius omnis illum.7Ea ullam harum dolorum dolores voluptas exercitationem delectus ex.7Asperiores unde ea ab ex inventore doloribus molestias ut.,Sat Jul 04 2020 22:45:25 GMT-0600 (Mountain Daylight Time),Garfield.Crist,Serenity.Walker@gmail.com,false,59,38,10
1,Aliquid velit ad.,true,Est repudiandae tempora eligendi et.,Repudiandae iste totam inventore explicabo.7Consequuntur aut labore tempore.7At hic et cum et.7Dolores omnis ea non.7Corporis distinctio magni.,Tue May 12 2020 06:40:32 GMT-0600 (Mountain Daylight Time),Frankie.Roberts,Joey9@gmail.com,true,387,50,1
2,Perspiciatis deserunt impedit.,false,,Quo in ratione qui aliquam rerum dolorem.7Et praesentium ipsa repudiandae est dolores voluptate dolorum qui.7Dolor consectetur repellat voluptas suscipit.7Deserunt voluptas voluptates debitis.7Facere asperiores asperiores saepe sint omnis.,Tue Jun 09 2020 00:09:26 GMT-0600 (Mountain Daylight Time),Garret.Schaefer,Alycia_Jenkins28@yahoo.com,false,112,37,12
3,Autem voluptas incidunt.,true,Delectus aut sed minus sed.,Illum qui dolorum.7Qui nihil delectus illum minus ipsum quia sint id rerum.7Sit numquam esse sed alias est.7Est enim tempora fugiat totam magnam ut voluptatem quibusdam similique.7Molestiae nemo nemo fugiat vitae aliquid a.,Sun May 31 2020 18:34:16 GMT-0600 (Mountain Daylight Time),Zelma_Zboncak,Meda_Botsford70@yahoo.com,true,466,45,19
5,Molestiae ea sit.,true,Et non distinctio eius assumenda.,Cum rerum perferendis quaerat aut.7Veritatis deserunt qui.7Vel sed porro tenetur iusto earum nam animi labore.7Quia quaerat est accusantium non et qui dolor.7Ducimus qui facere.,Fri May 01 2020 14:08:51 GMT-0600 (Mountain Daylight Time),Monty_Bartoletti,Joyce_Hoeger@gmail.com,true,453,29,2
1,Culpa doloribus aut.,false,,In suscipit voluptate quia voluptas alias ab.7Tempore reprehenderit est rem nemo soluta in tenetur nemo soluta.7Consequatur sequi et dolorum consequatur mollitia similique.7Sit aspernatur veritatis voluptate fuga consequatur nulla.7Fugiat eos ipsa.,Sat Jun 27 2020 16:06:15 GMT-0600 (Mountain Daylight Time),Corine.Ortiz,Eudora_Kuhlman82@hotmail.com,false,78,11,0
1,Error et doloribus.,true,Aut vitae laboriosam quasi modi.,Fugit iure fugiat incidunt aut quibusdam omnis commodi.7Iste dignissimos voluptatem alias facilis quibusdam.7Ex itaque voluptas eum vero omnis inventore.7Sed repellendus quia quasi autem.7Omnis sequi quo fugiat ullam eos est earum nostrum laudantium.,Wed May 06 2020 02:01:08 GMT-0600 (Mountain Daylight Time),Brionna_Bahringer79,Emmie.Kovacek76@gmail.com,true,21,30,8
1,Autem veniam fugit.,true,Ut consectetur dicta culpa vitae.,Non natus amet dolores dolores necessitatibus.7Voluptate dignissimos sunt voluptas dolor accusamus.7Quod dolorem molestiae illo incidunt illo fugiat deserunt ad.7Suscipit quo assumenda eos aliquam harum voluptatem reprehenderit atque ut.7Et adipisci iste quod quo ut totam enim.,Tue Jun 16 2020 13:49:25 GMT-0600 (Mountain Daylight Time),Kayden.Collier,Ronny.Wunsch78@yahoo.com,true,399,10,8
2,Quaerat corrupti quis.,false,,Optio modi quo minus dolore vel.7Deleniti incidunt beatae earum aut id quam.7Nisi qui autem.7Assumenda incidunt quibusdam hic esse sed.7Quis suscipit autem perferendis aut expedita et placeat ad accusantium.,Sat Jun 13 2020 04:30:42 GMT-0600 (Mountain Daylight Time),Joseph80,Rowland17@gmail.com,false,447,44,16
2,Animi laborum esse.,true,Vero veritatis in aut voluptatem.,Eveniet quidem illo inventore ratione sit a est et.7Enim praesentium accusamus in fugit qui et.7Quia illum dolores.7Veniam perspiciatis optio aliquam quae possimus omnis libero cumque.7Ducimus voluptatem natus minus non numquam natus illum molestiae.,Wed May 27 2020 08:43:05 GMT-0600 (Mountain Daylight Time),Anika_Lemke59,Watson.Hintz23@yahoo.com,true,315,1,5
1,Sit quam quis.,false,,Fuga mollitia hic rerum repudiandae.7Eum sed sed.7Possimus quia possimus ut.7Numquam iste at molestias exercitationem aliquam et.7Officiis et exercitationem ducimus sed accusantium quo explicabo.,Mon May 18 2020 20:41:32 GMT-0600 (Mountain Daylight Time),Eveline_VonRueden12,Natasha.Zieme69@gmail.com,false,160,46,2
4,Sequi velit error.,true,Repellendus voluptatibus id error aut.,Aut dolorem molestiae.7Nostrum quisquam qui amet nostrum quaerat tempore.7Fugit voluptatem impedit.7Adipisci laudantium facilis omnis magni quos rerum.7Numquam modi distinctio et earum nulla temporibus.,Sat Jun 20 2020 22:19:52 GMT-0600 (Mountain Daylight Time),Bridget_Bartoletti,Justina.Heidenreich@yahoo.com,true,118,16,11
2,Quo ut hic.,false,,Et repudiandae ut reiciendis ullam aut molestiae ducimus fuga.7Aspernatur est omnis dolorem iste quia sed.7Vel quis esse alias quis soluta consequuntur laboriosam molestiae consequatur.7Iste reprehenderit veritatis quo reprehenderit sapiente et eum.7Rerum quis perspiciatis sed consectetur dicta.,Mon Jun 29 2020 12:18:15 GMT-0600 (Mountain Daylight Time),Maxine.Thiel36,Reggie.Paucek78@gmail.com,false,365,49,1
5,Reprehenderit dolorum natus.,false,,Adipisci aliquam facere beatae neque consectetur aut.7Et quo modi voluptate ad omnis molestias omnis impedit.7Voluptas eius molestiae ratione soluta sequi sint dolores laudantium.7Autem qui distinctio rerum.7Occaecati magni nobis sit officiis vero at sit.,Sat Jun 27 2020 12:25:32 GMT-0600 (Mountain Daylight Time),Anissa_Rogahn,Clementina_Kemmer65@yahoo.com,false,370,8,13
1,Eius sequi voluptatibus.,true,Dolorem quas et consequatur voluptates.,Et asperiores est illo aperiam harum.7Nihil ut rem.7Et culpa occaecati deleniti aut consequuntur laborum voluptatem a illum.7Eos accusamus eum laboriosam.7Autem animi est.,Tue May 19 2020 01:28:55 GMT-0600 (Mountain Daylight Time),Gisselle_Ryan,Nannie.Marquardt@yahoo.com,true,146,49,1
3,Debitis ut eos.,false,,Voluptatum laborum aut deserunt nemo et distinctio omnis commodi.7Et est ipsam incidunt molestiae aut sapiente et eos sunt.7Consequatur aliquam non mollitia voluptas quis corrupti.7Deleniti veritatis animi ducimus accusamus architecto.7Molestiae quas consectetur sed similique natus eos distinctio enim.,Sat Jun 13 2020 04:00:17 GMT-0600 (Mountain Daylight Time),Nedra2,Leonel_Crooks@gmail.com,false,25,48,13
2,Ea ex voluptas.,false,,Voluptatum adipisci distinctio fuga quia nostrum.7Cum id omnis consequatur quia impedit.7Sed repellendus rerum quo veniam consectetur esse.7Consequuntur rem blanditiis nihil corporis est asperiores culpa quibusdam repellendus.7Ut et nostrum dolor qui cum ut ut.,Fri May 01 2020 22:25:52 GMT-0600 (Mountain Daylight Time),Santa_Hills,Brant_Kshlerin35@gmail.com,false,13,9,1
3,Beatae ut omnis.,true,Et quis asperiores sint qui.,Esse dolor nulla ipsa dolor quo saepe et et.7Deleniti quam sed molestiae alias laudantium accusantium a.7Dignissimos blanditiis placeat illum est qui vel.7Suscipit minima tempora quae et repellendus.7Velit et et aspernatur incidunt provident et dolorem.,Sat Jun 27 2020 03:36:01 GMT-0600 (Mountain Daylight Time),Jamie69,Jannie.Kiehn16@gmail.com,true,273,32,12
4,Ex nemo sit.,true,Suscipit doloremque est corrupti reprehenderit.,Nesciunt dicta sit atque exercitationem explicabo.7Nemo sunt sit hic est culpa.7Dicta veniam fuga ut.7Et similique ullam et fugit ut.7Eum quia nulla assumenda quia tenetur excepturi voluptatem laborum.,Tue Jun 23 2020 01:41:06 GMT-0600 (Mountain Daylight Time),Jayce_Altenwerth50,Clementine_VonRueden@hotmail.com,true,26,42,1
4,Non et omnis.,false,,Eum quaerat aut vero dolor corporis laborum numquam.7Voluptatem temporibus dolor.7Voluptatem id enim ut voluptatem veritatis corporis tempora et.7Sunt aut quia maiores quo earum.7Sint veritatis iusto non dolore dolorem ex ea.,Sun Jun 14 2020 23:57:24 GMT-0600 (Mountain Daylight Time),Doris.Wilderman,Maud_Spencer57@gmail.com,false,497,33,9
1,Aut earum voluptas.,false,,Nulla est ab esse reiciendis.7Recusandae eos adipisci illum vitae.7Delectus perspiciatis velit consequuntur.7Veritatis et exercitationem quis iusto consequatur voluptatem iusto minima.7Eos corporis fuga praesentium.,Thu May 07 2020 06:02:31 GMT-0600 (Mountain Daylight Time),Kristopher_Feest,Santino_Heller@yahoo.com,false,17,47,12
1,Iusto quibusdam voluptatem.,false,,Odio quo et quam consequatur cum et quae sit odit.7Modi voluptatibus voluptate nisi.7Vitae consequatur porro veritatis harum occaecati aut.7Illo molestiae ipsum fugiat ut ducimus ut dolorem vel.7Qui ab inventore cupiditate impedit amet et.,Tue Jun 30 2020 14:43:35 GMT-0600 (Mountain Daylight Time),Philip21,Hazle_Spinka79@hotmail.com,false,0,15,8
3,Et autem nulla.,false,,Quos placeat sunt quis.7Quisquam at voluptate labore soluta eligendi dicta nihil.7Tempore facere impedit voluptas iste et enim.7Ipsa qui laudantium qui qui accusantium.7Qui cumque et ea ipsam.,Sun Jun 14 2020 22:07:17 GMT-0600 (Mountain Daylight Time),Giovanni_Marquardt14,Dylan11@hotmail.com,false,187,42,6
4,Enim cum aut.,false,,Vitae repellat incidunt molestias exercitationem ipsam animi omnis.7Excepturi aut porro sit incidunt iusto quia quisquam dolor.7Eum corporis molestias qui sunt sed.7Quaerat consequatur voluptatem autem consequatur dolor.7Facere enim laudantium quod consequatur unde ut laboriosam.,Mon May 18 2020 09:23:31 GMT-0600 (Mountain Daylight Time),Wilhelm.Smitham,Ivah.Heidenreich@yahoo.com,false,315,5,12
5,Voluptatum molestiae exercitationem.,false,,Similique eum sed officia exercitationem.7Beatae delectus veritatis vel.7Et voluptatem blanditiis suscipit accusantium.7Vero nam explicabo nobis iusto.7Quo sint optio occaecati.,Wed Jul 08 2020 04:53:14 GMT-0600 (Mountain Daylight Time),Jamil_Stiedemann83,Concepcion26@gmail.com,false,221,3,4
5,Dicta magni et.,false,,Praesentium natus ipsam non dolorem deleniti.7Repellat dolorum et commodi quia rerum.7Nisi omnis aut.7Vel cumque temporibus voluptas in quia et.7Et et quo.,Mon May 18 2020 00:54:21 GMT-0600 (Mountain Daylight Time),Lexi20,Oliver.Kreiger@hotmail.com,false,234,38,1
3,At quas doloremque.,false,,Ut sed omnis.7Tempora dolor dolor fuga beatae sint odit voluptates et officia.7Error sunt velit.7Sequi vel minus autem ut rerum.7Ut ducimus sed eveniet dolores maxime et accusamus harum sint.,Mon May 04 2020 02:23:13 GMT-0600 (Mountain Daylight Time),Liliane.Botsford,Cordelia26@gmail.com,false,388,26,16
5,Sed perspiciatis qui.,false,,Architecto voluptas eligendi praesentium omnis mollitia.7Dolorum praesentium ex corporis qui dolorem reiciendis.7Repellat qui autem ducimus dolorem et consequuntur dicta et itaque.7Mollitia consequatur quia eos et eum rem excepturi neque.7Odit esse dolore quo a assumenda molestiae fuga.,Wed Jul 01 2020 14:41:28 GMT-0600 (Mountain Daylight Time),Malachi_Cronin,Janelle.Marquardt52@yahoo.com,false,41,37,0
5,Ipsam iure enim.,false,,Quas at tempora in.7Qui quae itaque nihil quos nemo maiores architecto est aut.7Itaque ipsam accusamus itaque reprehenderit nostrum ut consectetur.7Sit labore aut eaque ipsam quia consequatur ut.7Quasi occaecati ipsa earum a exercitationem.,Sat May 23 2020 14:36:55 GMT-0600 (Mountain Daylight Time),Gay98,Michaela53@yahoo.com,false,89,31,8
3,Sed voluptas neque.,false,,Eius tempora velit qui cupiditate deserunt.7Nihil repudiandae et aut et nam est.7Sed eos temporibus aperiam dolor tempora debitis reiciendis.7Natus sed numquam enim sequi unde.7Necessitatibus dolore impedit.,Wed Jul 01 2020 17:23:00 GMT-0600 (Mountain Daylight Time),Itzel.Bernier18,Ollie_Sporer30@gmail.com,false,17,27,0
3,Odio rerum nihil.,false,,Blanditiis expedita consequatur expedita placeat illo recusandae.7Eum rerum nam alias.7Aut qui hic minus.7Ab porro quo dolorem nihil aliquam rem qui laudantium.7Et qui adipisci quia itaque soluta corrupti sequi.,Mon Jun 22 2020 02:16:58 GMT-0600 (Mountain Daylight Time),Lila.Schaefer,Kassandra_Reilly@yahoo.com,false,477,2,6
5,Rerum tempore ut.,false,,Laboriosam consequatur saepe aut sequi.7Laborum ad quam officiis ut.7Qui quo sunt repellat aut perspiciatis.7Ea ullam in iusto qui.7Doloremque omnis doloremque quo accusantium quia.,Sun Jul 05 2020 15:56:17 GMT-0600 (Mountain Daylight Time),Nels_Cole38,Alexandro.Klocko4@yahoo.com,false,206,36,2
5,Quisquam id autem.,true,Libero aliquid temporibus possimus qui.,Quia magnam aut voluptas ab qui cum rerum exercitationem.7Dolorem tempore rerum explicabo quam laudantium unde commodi qui quis.7Sed est odio laudantium quaerat.7Quidem mollitia pariatur.7Nulla consectetur eum ut magni quis commodi qui.,Tue May 05 2020 22:06:26 GMT-0600 (Mountain Daylight Time),Casper.Wilderman,Laverna16@yahoo.com,true,250,19,15
2,Facilis quam ea.,false,,Adipisci beatae in excepturi neque unde recusandae iure et vel.7Repudiandae sint omnis consequuntur.7Dolore quidem quod quam qui aut rerum quis dignissimos.7Expedita sint totam autem aut quisquam.7Occaecati perferendis quia.,Mon Jun 01 2020 21:39:01 GMT-0600 (Mountain Daylight Time),Kurtis.Schmeler,Destany.Sanford@hotmail.com,false,483,26,1
2,Ea et ipsam.,true,Eaque sunt quia sit distinctio.,Nostrum saepe doloribus illum alias aut facilis voluptatum dolor excepturi.7Autem provident et rerum ea inventore.7Veniam ut repellat dolorum sed iusto tempora voluptatem nesciunt.7Provident totam ut.7Nobis vitae ad quis id ut sapiente.,Wed May 06 2020 20:40:55 GMT-0600 (Mountain Daylight Time),Angelina.Larson42,Christian88@yahoo.com,true,5,6,4
1,Voluptatem autem tempora.,false,,Quibusdam aut molestias possimus facere facilis accusamus.7Accusantium et hic.7Aut sint illo et sit blanditiis ut labore reiciendis commodi.7Non rem et quo totam soluta est.7Maiores nostrum eveniet et eum autem nisi id ipsa.,Sat Jun 27 2020 09:37:16 GMT-0600 (Mountain Daylight Time),Salvatore31,Theresia55@yahoo.com,false,217,15,11
4,Architecto quis et.,false,,Vel ipsa praesentium quae ipsa quia et natus omnis aliquam.7At rerum magni aut eum tenetur omnis ipsa quos.7Quis nulla illum id necessitatibus voluptate nesciunt veritatis.7Velit nihil qui eos exercitationem sed veniam voluptate omnis.7In porro ullam mollitia dolor et eos.,Thu Jul 02 2020 23:11:07 GMT-0600 (Mountain Daylight Time),Dangelo_West,Shanon.Breitenberg31@gmail.com,false,271,27,9
5,Ut quo nihil.,true,Recusandae quia eum qui reprehenderit.,Praesentium tempora quia ea tempore temporibus eum fugiat accusamus.7Sapiente non iste.7Inventore maxime esse assumenda illo deleniti ut.7Aut atque molestias amet possimus qui sunt.7Et quaerat et esse voluptatem vero optio.,Thu Jun 25 2020 05:14:02 GMT-0600 (Mountain Daylight Time),Rogelio.Kuhn,Joanie.Weimann@hotmail.com,true,394,21,20
3,Consequatur recusandae dolorem.,true,Quibusdam quidem cum est voluptas.,Tempora beatae ducimus et aut qui deleniti.7Vel sit et fuga doloribus quas sit quia.7Dolorem ducimus eaque.7Non explicabo sed fugiat quia nesciunt beatae.7Vel quis occaecati natus atque rem.,Sun May 31 2020 17:15:34 GMT-0600 (Mountain Daylight Time),Tabitha.West,Louvenia.Pfannerstill96@gmail.com,true,152,36,6
2,Occaecati sapiente aut.,false,,Id quam dolores praesentium cupiditate rem.7Non libero voluptate nulla.7Eum architecto autem.7Molestias necessitatibus earum dignissimos nihil dignissimos unde explicabo ipsa.7Quia iste ex autem autem est error voluptatem.,Sat May 30 2020 00:49:12 GMT-0600 (Mountain Daylight Time),Katelyn.Hoppe,Destiney_Aufderhar@hotmail.com,false,319,3,0
1,In cum nemo.,true,Qui enim tenetur quia id.,Et quaerat reiciendis ea iusto illum consequatur sint.7Quo ipsa vero tempora qui quae atque temporibus velit.7Dolor et a quo.7Qui voluptatem officia.7Qui quod nam iusto laboriosam dolorem ad suscipit amet quidem.,Mon Jun 22 2020 02:10:49 GMT-0600 (Mountain Daylight Time),Amina23,Bessie.Dickens@gmail.com,true,490,34,14
2,Explicabo harum facilis.,true,Quos natus sed aut sed.,Nam laborum sint.7Amet at cum voluptatem dolores.7Aspernatur ea possimus sed.7Quisquam tenetur dicta earum dolor laborum eveniet.7Et qui deleniti vitae qui.,Thu Jun 18 2020 13:46:02 GMT-0600 (Mountain Daylight Time),Princess7,Kyler.Krajcik@gmail.com,true,219,49,1
3,Pariatur nobis similique.,false,,Cupiditate qui officiis animi iure.7Ut blanditiis ducimus alias voluptatem et.7Error doloribus odio tenetur voluptatibus voluptates eveniet quis et.7Ullam sunt voluptates ipsa sunt.7Ad fugit labore et unde quas rem alias et.,Wed May 06 2020 01:53:27 GMT-0600 (Mountain Daylight Time),Rasheed_Spencer63,Richmond65@yahoo.com,false,212,30,6
4,Dolorem quia a.,true,Ut veniam corporis voluptate dicta.,Voluptatem ea consequuntur tempora molestiae tempora eius minima hic.7Recusandae explicabo porro omnis non est non rerum omnis alias.7Minus cum aut et beatae corporis magni.7Consequatur quisquam laudantium.7Fugiat voluptatem possimus saepe aliquam voluptates ipsa.,Sat Jun 20 2020 21:23:46 GMT-0600 (Mountain Daylight Time),Madelynn.Lesch,Marta55@gmail.com,true,307,50,15
2,Aut soluta et.,false,,Molestias voluptatibus modi repudiandae ipsum maiores voluptas.7Voluptas quasi quia dolorum maiores est.7Et velit est rerum et adipisci neque ducimus.7Sunt eum reiciendis.7Molestias rerum eum.,Thu Jun 25 2020 05:34:21 GMT-0600 (Mountain Daylight Time),Russ.Reichel57,Danyka16@hotmail.com,false,256,50,15
5,Soluta earum sapiente.,true,Id et quae laborum eos.,Aut dolor cumque excepturi unde.7Ipsum vero natus excepturi in quam soluta.7A esse odit doloremque porro magni non illo in.7Aut minus facere eos.7Temporibus quaerat ipsa quia recusandae facilis sed ad.,Fri Jun 05 2020 08:29:45 GMT-0600 (Mountain Daylight Time),Neva77,Roman87@hotmail.com,true,173,33,11
4,Consequuntur modi enim.,true,Omnis non dolores corporis dolor.,Perferendis eaque alias.7Facilis aliquid ea ducimus tempore voluptas voluptatibus labore officia culpa.7Voluptates cum qui.7Quia est beatae.7Commodi eos magnam quia tenetur quod voluptatum.,Mon May 18 2020 02:04:54 GMT-0600 (Mountain Daylight Time),Arno_Jaskolski,Cora13@yahoo.com,true,453,38,6
1,Non et delectus.,false,,Quos est assumenda velit voluptatibus harum dolor repellendus.7Facere qui debitis.7Consequatur aut voluptatem fugit.7Iusto illum et molestiae.7Et temporibus rem animi voluptas.,Mon Jul 06 2020 22:12:23 GMT-0600 (Mountain Daylight Time),Geovany7,Wyman_Cronin18@gmail.com,false,42,40,11
4,Rem explicabo vel.,false,,Est sequi deserunt placeat magni enim illo doloribus ipsa qui.7Est voluptatem et.7Ea dolorem et perspiciatis ut molestiae.7Nihil dolorem aliquid beatae tenetur iusto.7Est molestiae officia rem quibusdam consequatur beatae sapiente quia.,Mon May 04 2020 22:45:14 GMT-0600 (Mountain Daylight Time),Anais_Mante,Julius_Runolfsson@yahoo.com,false,305,14,4
5,Quia nemo quo.,false,,Aut sit veniam reiciendis iste ea.7Blanditiis est repudiandae commodi maiores.7Qui officiis labore est quas rerum officiis.7Ut veniam iure.7Non ut voluptatibus temporibus provident quo aliquid est sint.,Fri May 29 2020 03:25:54 GMT-0600 (Mountain Daylight Time),Sharon.Waters50,Shana.Gusikowski@gmail.com,false,478,43,0
5,Ab natus rerum.,false,,Ipsa quis aliquid.7Sit enim eum autem magni maxime non.7Occaecati autem sed dolorem totam fuga sunt aut est.7Veniam veritatis quos fuga itaque vel aperiam quaerat distinctio.7Ea commodi placeat.,Sat Jun 27 2020 06:12:23 GMT-0600 (Mountain Daylight Time),Effie.Macejkovic7,Neha88@hotmail.com,false,138,35,20
1,Dolorem ut distinctio.,true,Ex quam accusamus aut doloremque.,Dignissimos est in aliquid dolor deserunt vel deleniti.7Voluptatem aut tempore sit et sit pariatur in eveniet numquam.7Quia in magni exercitationem sunt sint.7Ut voluptate iure velit sed minus.7Aut et sit et eos est quo sequi animi nostrum.,Tue Jun 30 2020 09:06:05 GMT-0600 (Mountain Daylight Time),Nia99,Herbert19@hotmail.com,true,361,12,12
2,Quis ut molestiae.,true,Molestiae quia velit modi impedit.,Laudantium aut omnis vitae est non optio.7Sit animi quia tenetur repellendus.7Id reprehenderit ut molestiae quis.7Ut fuga voluptatibus aut consequatur quis qui commodi.7Quas eos nesciunt omnis.,Tue Jun 30 2020 06:54:50 GMT-0600 (Mountain Daylight Time),Kiel96,Karley_Kassulke@gmail.com,true,265,4,20
1,Reprehenderit ut aut.,true,Commodi incidunt ab et omnis.,Aliquam minima atque quasi similique ut odio ut architecto.7Sequi id voluptas ut placeat eum quia facere odio qui.7Ea accusantium molestiae et qui est est voluptatum.7Assumenda impedit et.7Officia quia vero maiores voluptas itaque in qui quae.,Wed May 06 2020 09:58:45 GMT-0600 (Mountain Daylight Time),Lurline.Brekke9,Hattie.Powlowski1@hotmail.com,true,492,50,11
4,Natus aliquam quis.,false,,Blanditiis a aut qui ipsam ut non facere.7Et ad atque ex est unde numquam quidem porro.7Aperiam quod natus velit aspernatur reiciendis.7Corrupti harum et omnis quasi consectetur officia nam.7Et sed voluptate sed animi et et modi.,Fri Jul 03 2020 14:08:12 GMT-0600 (Mountain Daylight Time),Corine70,Keith91@hotmail.com,false,225,9,5
1,Omnis ipsa et.,false,,Nobis ut occaecati laboriosam consequuntur totam.7Itaque ab id distinctio quas repudiandae reprehenderit.7Optio et illo libero architecto pariatur excepturi ea.7Velit aliquam odit debitis.7Fugiat asperiores iusto minima sit in sint aliquid.,Sun May 31 2020 12:42:08 GMT-0600 (Mountain Daylight Time),Jamaal_Simonis61,Harvey.Wyman42@gmail.com,false,72,39,11
2,Deserunt neque nihil.,false,,Libero ipsa voluptas quo.7Est ad ut error et.7Et ut hic.7Aut nobis veritatis beatae eius.7Quae molestiae tempora molestiae impedit dolorem sit doloribus.,Thu May 14 2020 11:59:05 GMT-0600 (Mountain Daylight Time),Maryjane46,Geovanni.Ryan@gmail.com,false,492,15,7
1,Ipsam autem odit.,true,Et rerum autem id voluptas.,Ducimus voluptas sapiente animi doloribus unde sequi.7Aut rerum odit.7Fugiat necessitatibus voluptates tempore numquam assumenda inventore.7Qui nesciunt omnis nemo saepe aut nam aspernatur explicabo eius.7Soluta suscipit nulla veniam.,Fri May 15 2020 14:10:23 GMT-0600 (Mountain Daylight Time),Cristopher.Strosin26,Mason57@gmail.com,true,372,6,6
4,Nostrum et vitae.,false,,Voluptatibus voluptates est accusamus et est maxime consequatur in necessitatibus.7Maxime velit iste id tempora iure aut quam ipsum rerum.7Consectetur dicta magni delectus id consectetur quia ullam dolor voluptas.7Temporibus aut corporis fuga.7Vel facere neque rerum eius sit harum soluta accusantium est.,Fri May 29 2020 11:49:36 GMT-0600 (Mountain Daylight Time),Jaylan_Hauck,Glennie.Stracke@yahoo.com,false,256,22,6
2,Beatae at neque.,true,Error placeat eos labore qui.,Est quae culpa.7Nihil expedita velit architecto sit animi rerum.7Consequatur labore molestiae ut recusandae inventore sit dolor.7In nemo ut saepe aliquid et.7Inventore voluptas corporis occaecati.,Sat Jul 04 2020 05:46:08 GMT-0600 (Mountain Daylight Time),Reece95,Daniela_Bechtelar@yahoo.com,true,27,10,11
2,Aut repudiandae dolorem.,true,Unde dolores et ut dolorem.,Perspiciatis eligendi molestiae et officiis sit expedita cum.7Laborum omnis ea placeat et.7Aut enim velit ipsa aut quis accusamus beatae ab.7Quis fuga dolor.7Accusantium laudantium ad qui nulla ullam deleniti dicta porro iure.,Tue Jun 02 2020 20:06:37 GMT-0600 (Mountain Daylight Time),Delores.Langosh60,Joanie_Kshlerin89@gmail.com,true,102,47,16
1,Animi voluptatum vel.,true,Vel sed aliquid sint ut.,Pariatur aperiam sit omnis qui et quidem occaecati quo nesciunt.7Autem optio maiores a.7Quia laboriosam consectetur nobis omnis aut officiis.7Cum dolor doloribus.7Blanditiis in voluptatibus sint autem et occaecati debitis.,Wed Jun 17 2020 21:49:58 GMT-0600 (Mountain Daylight Time),Susana.Zemlak,Hilda_Mayert@yahoo.com,true,319,23,0
3,Quae omnis laudantium.,true,Repellendus ut incidunt odio qui.,Rerum voluptas sapiente consequuntur.7Recusandae impedit possimus.7Non iure sit quis ea qui corrupti.7Voluptatem distinctio voluptatibus facere minus sed quisquam.7Tempora non illum ut et et.,Fri May 29 2020 10:56:14 GMT-0600 (Mountain Daylight Time),Dalton40,Hiram.Fritsch@gmail.com,true,451,31,7
1,Facilis rem minima.,true,Tenetur dolores enim aperiam sunt.,Veritatis consequatur cupiditate saepe dolores a rem.7Pariatur architecto pariatur.7Omnis vel porro maiores nesciunt.7Qui iure fugit.7Nihil ut tenetur aut earum provident eveniet rerum dolorem.,Tue May 05 2020 09:20:35 GMT-0600 (Mountain Daylight Time),Dariana35,Mina.Murazik91@gmail.com,true,1,15,4
3,Qui dolores nulla.,false,,Enim dolores ab.7Nam quia deleniti quia.7Sit eos molestias ipsum veniam eius.7Voluptas officia fugit et.7Maxime pariatur vero nulla.,Mon Jun 22 2020 07:01:50 GMT-0600 (Mountain Daylight Time),Alena84,Clemmie_Ryan42@gmail.com,false,84,23,14
2,Quas voluptate ut.,false,,Deserunt quam perferendis totam esse voluptatem perferendis corporis natus.7Est omnis repellendus quisquam et aperiam et veniam.7Rerum qui et cupiditate tenetur.7Nam eligendi sint sed autem praesentium.7Assumenda rerum sequi excepturi molestiae atque optio vero.,Tue May 26 2020 20:23:27 GMT-0600 (Mountain Daylight Time),Johanna54,Justina_Reynolds68@gmail.com,false,356,45,20
5,Delectus at voluptatem.,true,Laboriosam ipsa delectus ut et.,Blanditiis dolorem est odit animi non ut.7Eaque sequi culpa consequuntur impedit voluptas explicabo dolor voluptas.7Sit nesciunt ut.7Sequi voluptatem et officiis aut et aut eos ea dolor.7Quis incidunt fugiat.,Thu Jun 18 2020 23:51:35 GMT-0600 (Mountain Daylight Time),Amanda.Spinka,Nick.Jerde87@hotmail.com,true,464,49,12
3,Natus ad nihil.,true,Repellat necessitatibus esse veritatis maiores.,Ut saepe rerum velit et.7Reiciendis sint expedita sequi eaque sint inventore qui aut.7Hic sed harum quae dicta in temporibus ut.7Ipsa et in fugiat impedit atque in temporibus.7Facere ut quo est nulla veritatis.,Sun Jun 21 2020 07:20:14 GMT-0600 (Mountain Daylight Time),Randy_Fahey55,Shanel.OConner65@gmail.com,true,329,37,13
